{
  "schema_version": "1.0.0",
  "generated_at": "2026-10-25T03:20:00Z",
  "device": {
    "id": "ryzen9-9950x-rtx3080",
    "name": "Ryzen 9 9950X + RTX 3080 20GB Workstation",
    "form_factor": "desktop",
    "soc_or_cpu": "AMD Ryzen 9 9950X (16C/32T Zen 5)",
    "cpu_cores_threads": "16C/32T",
    "cpu_isa_flags": ["SSE4.2", "AVX2", "FMA", "AVX-512F", "AVX512-VNNI", "AVX512-BF16", "AVX512-VBMI"],
    "gpu_model": "NVIDIA GeForce RTX 3080 20GB",
    "gpu_vram_gb": 20.0,
    "npu_model": null,
    "ram_gb": 64.0,
    "ram_type": "DDR5",
    "os": "Windows 11 Pro 24H2 + WSL2 Ubuntu 24.04",
    "compute_units": ["CPU", "GPU"]
  },
  "asr_benchmarks": [
    {
      "unit": "CPU",
      "tier": "T1_CPU_BASELINE",
      "route_label": "ORT CPU · FP32 · 4T",
      "runtime": "onnxruntime 1.24.4",
      "precision": "FP32",
      "threads": 4,
      "streams_or_processes": 1,
      "status": "ok",
      "window_10s_ms": 123.58,
      "call_378s_s": null,
      "meeting_2957s_s": null,
      "realtime_factor_x": null,
      "effective_tflops": 0.028,
      "peak_tflops_ref": 2.9,
      "hardware_utilization_pct": 1.0,
      "power_scope": null,
      "avg_delta_power_w": null,
      "total_energy_j": null,
      "cer_pct": 11.1,
      "notes": "Single 10s window FP32 baseline on 4 threads"
    },
    {
      "unit": "CPU",
      "tier": "T3_CPU_MATRIX_ISA",
      "route_label": "sherpa-onnx INT8 · AVX-512 VNNI · 4T",
      "runtime": "sherpa-onnx 1.13.8 (ORT AVX512_VNNI)",
      "precision": "INT8",
      "threads": 4,
      "streams_or_processes": 1,
      "status": "ok",
      "window_10s_ms": 75.56,
      "call_378s_s": 4.2,
      "meeting_2957s_s": 29.13,
      "realtime_factor_x": 101.5,
      "effective_tflops": 0.046,
      "peak_tflops_ref": null,
      "hardware_utilization_pct": null,
      "power_scope": null,
      "avg_delta_power_w": null,
      "total_energy_j": null,
      "cer_pct": 11.6,
      "notes": "ORT INT8 automatically dispatches AVX-512 VNNI on Zen 5"
    },
    {
      "unit": "CPU",
      "tier": "T3_CPU_MATRIX_ISA",
      "route_label": "sherpa-onnx INT8 · AVX-512 VNNI · 8T",
      "runtime": "sherpa-onnx 1.13.8 (ORT AVX512_VNNI)",
      "precision": "INT8",
      "threads": 8,
      "streams_or_processes": 1,
      "status": "ok",
      "window_10s_ms": 53.97,
      "call_378s_s": 3.39,
      "meeting_2957s_s": 27.2,
      "realtime_factor_x": 108.7,
      "effective_tflops": 0.065,
      "peak_tflops_ref": null,
      "hardware_utilization_pct": null,
      "power_scope": null,
      "avg_delta_power_w": null,
      "total_energy_j": null,
      "cer_pct": 11.6,
      "notes": "Optimal single-task thread count on 9950X (32P×2T multi-process reaches 380.46x realtime)"
    },
    {
      "unit": "GPU",
      "tier": "T4_GPU_ACCELERATED",
      "route_label": "RTX 3080 20GB · ORT CUDA FP32",
      "runtime": "onnxruntime-gpu (CUDAExecutionProvider)",
      "precision": "FP32",
      "threads": 4,
      "streams_or_processes": 1,
      "status": "ok",
      "window_10s_ms": 24.8,
      "call_378s_s": 1.9,
      "meeting_2957s_s": 13.4,
      "realtime_factor_x": 220.7,
      "effective_tflops": 0.141,
      "peak_tflops_ref": 29.8,
      "hardware_utilization_pct": 0.47,
      "power_scope": "gpu_board_nvml",
      "avg_delta_power_w": 169.09,
      "total_energy_j": 1775.4,
      "cer_pct": 11.1,
      "notes": "324 packed 10s windows for 49.3m meeting (10.5s process time)"
    }
  ],
  "llm_benchmarks": [
    {
      "model": "Qwen3-4B-Instruct-2507",
      "params_b": 4.02,
      "quantization": "Q4_0",
      "model_size_gb": 2.21,
      "unit": "GPU",
      "tier": "T4_GPU_ACCELERATED",
      "route_label": "RTX 3080 20GB · Vulkan (-ngl 99)",
      "isa_or_backend": "Vulkan",
      "threads": 8,
      "status": "ok",
      "load_s": 0.45,
      "prompt_tokens": 1000,
      "gen_tokens": 128,
      "ttft_ms": 185,
      "prefill_tps": 5393.28,
      "decode_tps": 195.21,
      "pp128_tps": 5212.1,
      "pp1000_tps": 5393.28,
      "tg32_tps": 199.13,
      "tg128_tps": 195.21,
      "mem_avail_before_gb": 36.5,
      "mem_avail_after_gb": 35.8,
      "vram_used_gb": 3.7,
      "vram_total_gb": 20.0,
      "overflow_detected": false,
      "power_scope": "gpu_board_nvml",
      "decode_delta_power_w": 146.5,
      "decode_energy_j_per_tok": 0.748,
      "notes": "Full GPU offload on RTX 3080 20GB (122.9x faster prefill than SSE4.2)"
    },
    {
      "model": "Qwen3-4B-Instruct-2507",
      "params_b": 4.02,
      "quantization": "Q4_0",
      "model_size_gb": 2.38,
      "unit": "CPU",
      "tier": "T1_CPU_BASELINE",
      "route_label": "CPU · SSE4.2 Baseline (8T)",
      "isa_or_backend": "SSE4.2",
      "threads": 8,
      "status": "ok",
      "load_s": null,
      "prompt_tokens": 128,
      "gen_tokens": 32,
      "ttft_ms": null,
      "prefill_tps": 43.89,
      "decode_tps": 9.6,
      "pp128_tps": 43.89,
      "pp1000_tps": null,
      "tg32_tps": 9.6,
      "tg128_tps": null,
      "mem_avail_before_gb": 36.5,
      "mem_avail_after_gb": 34.0,
      "vram_used_gb": null,
      "vram_total_gb": 20.0,
      "overflow_detected": false,
      "power_scope": null,
      "decode_delta_power_w": null,
      "decode_energy_j_per_tok": null,
      "notes": "llama.cpp b79e2e74 compiled with -msse4.2 only"
    },
    {
      "model": "Qwen3-4B-Instruct-2507",
      "params_b": 4.02,
      "quantization": "Q4_0",
      "model_size_gb": 2.38,
      "unit": "CPU",
      "tier": "T2_CPU_VECTOR_INT8",
      "route_label": "CPU · AVX2 + FMA (8T)",
      "isa_or_backend": "AVX2",
      "threads": 8,
      "status": "ok",
      "load_s": null,
      "prompt_tokens": 1000,
      "gen_tokens": 128,
      "ttft_ms": 8450,
      "prefill_tps": 118.34,
      "decode_tps": 19.83,
      "pp128_tps": 140.13,
      "pp1000_tps": 118.34,
      "tg32_tps": 9.79,
      "tg128_tps": 19.83,
      "mem_avail_before_gb": 36.5,
      "mem_avail_after_gb": 34.0,
      "vram_used_gb": null,
      "vram_total_gb": 20.0,
      "overflow_detected": false,
      "power_scope": null,
      "decode_delta_power_w": null,
      "decode_energy_j_per_tok": null,
      "notes": "llama.cpp b79e2e74 compiled with AVX2 + FMA + F16C"
    },
    {
      "model": "Qwen3-4B-Instruct-2507",
      "params_b": 4.02,
      "quantization": "Q4_0",
      "model_size_gb": 2.38,
      "unit": "CPU",
      "tier": "T3_CPU_MATRIX_ISA",
      "route_label": "CPU · AVX-512 VNNI + BF16 (16T)",
      "isa_or_backend": "AVX-512",
      "threads": 16,
      "status": "ok",
      "load_s": null,
      "prompt_tokens": 1000,
      "gen_tokens": 32,
      "ttft_ms": 2810,
      "prefill_tps": 355.92,
      "decode_tps": 21.18,
      "pp128_tps": 386.42,
      "pp1000_tps": 355.92,
      "tg32_tps": 21.18,
      "tg128_tps": null,
      "mem_avail_before_gb": 36.5,
      "mem_avail_after_gb": 34.0,
      "vram_used_gb": null,
      "vram_total_gb": 20.0,
      "overflow_detected": false,
      "power_scope": null,
      "decode_delta_power_w": null,
      "decode_energy_j_per_tok": null,
      "notes": "8.8x faster prefill and 2.2x faster decode vs SSE4.2"
    }
  ]
}
